{
  "$schema": "https://json-schema.org/draft/2020-12/schema",
  "title": "deviation",
  "description": "One thing the specification does not settle, found while building. Written by a role to .c4s-impl/deviations/<id>.json; shipped by the orchestrator at the end of the iteration with `c4s create-patch`, whose patch kinds it uses.",
  "type": "object",
  "additionalProperties": false,
  "required": [
    "id",
    "kind",
    "blocking",
    "address",
    "text",
    "sent"
  ],
  "properties": {
    "id": {
      "type": "string",
      "pattern": "^dev-[0-9]{4}$"
    },
    "kind": {
      "enum": [
        "missing",
        "incorrect",
        "clarification",
        "drift"
      ],
      "description": "missing: the specification is silent; incorrect: two places disagree, or one is wrong about what exists; clarification: ambiguous, or not buildable as written; drift: delta window only, the code already does something else"
    },
    "blocking": {
      "type": "boolean",
      "description": "true when any assumption would change a contract another unit relies on; false when an ASSUMPTION marker is safe"
    },
    "address": {
      "type": "string",
      "description": "<unit>/<layer> or <unit>/<section anchor>: the place in the specification the deviation is about"
    },
    "slugs": {
      "type": "array",
      "items": {
        "type": "string"
      }
    },
    "text": {
      "type": "string",
      "description": "what was found, and what the implementer assumed (non-blocking) or needs (blocking)"
    },
    "assumption": {
      "type": "string",
      "description": "the ASSUMPTION:<id> marker text placed in code, for a non-blocking deviation"
    },
    "unit": {
      "type": "string"
    },
    "portion": {
      "type": "string"
    },
    "sent": {
      "type": "boolean"
    },
    "patchPath": {
      "type": "string",
      "description": "filled after `c4s create-patch` succeeds"
    }
  }
}
