{
  "id": "dev-0010",
  "kind": "clarification",
  "blocking": false,
  "address": "u09-remote-token-encryption/yuhlv2qw",
  "unit": "u09-remote-token-encryption",
  "portion": "u09-remote-token-encryption/p1-l1-l1",
  "slugs": [
    "section:yuhlv2qw",
    "remote-session",
    "ac-po-http-401-z-owner-only-endpointu-zdaln"
  ],
  "text": "Sekcja yuhlv2qw mówi, że token sesji zdalnej jest „odszyfrowywany wyłącznie po stronie serwera, tuż przed wywołaniem remote'a”, a AC ac-po-http-401-z-owner-only-endpointu-zdaln opisuje 401 z owner-only endpointu dla tokenu z lokalnej sesji. Od usunięcia M25 (2.1.55) żaden kod nie wykonuje wywołania zdalnego z tokenem ODCZYTANYM z `remote_session` — jedynym owner-only wywołaniem jest `GET /v1/account` tuż po logowaniu, ze świeżym tokenem z DeviceTokenResponse (M24 sam mówi: „Dziś żadna akcja aplikacji nie wymaga tej tożsamości”). Przyjęte: token jest szyfrowany przy zapisie (`RemoteAuthService.persistSession`, prymityw M05 `agent-credential-crypto.ts`) i jednorazowo migracją 062 (krok danych w kodzie, `src/server/db/code-migrations.ts`); ścieżki odszyfrowania w M24 nie dodano, bo nie miałaby wywołującego (martwy kod) — pierwszy konsument tokenu doda odszyfrowanie przy swoim wywołaniu. AC 401 jest realizowane na jedynym owner-only wywołaniu: 401 z `GET /v1/account` po logowaniu kasuje lokalną `remote_session` i porzuca flow (nowy device flow wymagany).\n\nSugestia: dopisać w yuhlv2qw (albo w opisie kolumny `access_token`), że dziś nie ma wywołania z zapisanym tokenem, więc odszyfrowanie dotyczy przyszłych konsumentów; ewentualnie doprecyzować AC 401, że dziś dotyczy post-login `GET /v1/account`.",
  "assumption": "ASSUMPTION:dev-0010 no M24 code reads the stored token today; decryption is left to its first consumer, the 401 wipe applies to the post-login GET /v1/account",
  "sent": true,
  "patchPath": "2-1-56-to-2-1-57-u09-remote-token-encryption-yuhlv2qw-sekcja-yuhlv2qw-mowi-ze-token-sesji-zdalnej.md"
}