{
  "id": "dev-2809",
  "kind": "clarification",
  "blocking": false,
  "address": "kit-detail-history/entity-version-history-view",
  "slugs": [
    "entity-version-history-view",
    "ac-entityversionhistoryview-przy-showrel",
    "ac-w-widoku-entityversionhistoryview-wers"
  ],
  "text": "The entity-version-history-view record says `showReleasePill` (default `true`) \"przełącza nagłówek grupy release na postać „Release <id>”\", and ac-entityversionhistoryview-przy-showrel says the block WITH `showReleasePill` heads a release group \"Release <id>\". The code before this window did the opposite: `true` headed the group with the release name, `false` with \"Release <numeric id>\". The record does not say what `false` renders, nor whether `<id>` is the release's numeric id or its name (a release is addressed by its name, 2.1.11). Built: with `showReleasePill` (default) the heading is \"Release <name>\" (the numeric id only while the name is not loaded); with `false` it is the bare release name. So the host's own history routes now read \"Release 2.1.0\" instead of \"2.1.0\". Needs: the record to state the `false` form and what `<id>` is.",
  "assumption": "ASSUMPTION:dev-2809 — `showReleasePill` (default true) heads a release group \"Release <release name>\" (numeric id as fallback); `false` heads it with the bare release name.",
  "unit": "kit-detail-history",
  "portion": "kit-detail-history/p1-l11-l12",
  "sent": true,
  "patchPath": "2-1-27-to-2-1-28-kit-detail-history-entity-version-history-view-the-entity-version-history-view-r.md"
}