{
  "id": "dev-0008",
  "kind": "clarification",
  "blocking": false,
  "address": "m46-bubble-series/eexh96s5",
  "slugs": [
    "ac-maksymalnie-jedna-banka-transagenta-j",
    "transagent-tools-runtransagent",
    "katalog-operacji-m46#spawn_child_turn"
  ],
  "text": "At 2.1.18 the relaxed rule is stated in M46 `9w7zk9as`, the `runTransagent` entity (description + logic), the `katalog-operacji-m46` row (krotność: at most one banka at a time, sequential calls in one turn allowed) and the AC title (\"w locie naraz\"). But the edge-case section `eexh96s5` at 2.1.18 still reads: \"Tura rodzica próbuje odpalić drugą bańkę równolegle — niemożliwe z konstrukcji: wywołanie jest blokujące, więc maksymalnie jedna bańka jest w locie na turę rodzica\" — the retired \"per parent turn\" wording. Built per the entity/row/AC (one in flight at a time, a series in one turn allowed). Decided here: the spec says a parallel second bubble is impossible \"by construction\" (the call blocks) but does not say what happens if the runtime ever dispatched two `tool_use(runTransagent)` of one assistant message concurrently. The dispatcher (one per parent turn) now serializes `run()`: a call arriving while a banka is in flight waits for it to return before it takes its tool_use id or founds a row — it is not refused. Suggest rewording the `eexh96s5` bullet to \"maksymalnie jedna bańka jest w locie naraz; kolejne wywołania w tej samej turze ruszają po zwrocie poprzedniego\" and, if wanted, naming the parallel-dispatch behaviour (wait vs refuse).",
  "assumption": "ASSUMPTION:dev-0008 — a runTransagent call that arrives while another banka of the same parent turn is in flight waits for it (serialized per dispatcher), rather than being refused.",
  "unit": "m46-bubble-series",
  "portion": "m46-bubble-series/p1-l3-l15",
  "sent": true,
  "patchPath": "2-1-17-to-2-1-18-m46-bubble-series-eexh96s5-at-2-1-18-the-relaxed-rule-is-stated-in-m46-9w7zk9as-.md"
}