{
  "id": "dev-0951",
  "kind": "missing",
  "blocking": false,
  "address": "workspace-settings-split/m26route",
  "slugs": [
    "workspace-settings-page",
    "ac-ikona-zebatki-w-prawym-gornym-rogu"
  ],
  "text": "At 2.1.58 the Appearance card (M50 6tn2yf92) and the Plugin pool card (M33 df0ri1ao) move to the workspace settings page /workspace/settings, a workspace route reachable only from the workspace route frame's gear. The project route's header (M50 8h2a734u, per dev-0701) holds the gear to /settings, the project name and the project switcher — nothing that leads to the workspace route frame (/welcome or /workspace/settings). So a user working inside a project has no in-app way to change the theme or see the workspace plugin pool: they must type /workspace/settings by hand. The pages do not say whether the project route should carry a link to the workspace settings page (e.g. from the project settings page, the switcher, or the header). Built as written: no such link.",
  "unit": "workspace-settings-split",
  "portion": "workspace-settings-split/p1-l5-l17",
  "sent": true,
  "patchPath": "2-1-57-to-2-1-58-workspace-settings-split-m26route-at-2-1-58-the-appearance-card-m50-6tn2yf92-and.md"
}
