{
  "id": "m21-dev-0001",
  "kind": "drift",
  "blocking": false,
  "address": "m21-brief-tools/L3",
  "slugs": [
    "katalog-operacji-m21#update_brief",
    "brief-tools-update-brief"
  ],
  "text": "At 2.1.14 the `update_brief` row describes content `obydwa` — the literal action shape or the differential `textEdits` under the M43 contract (literal-match, match-count-declared) — but its `kody błędów` cell still lists only BRIEF_NOT_FOUND, BRIEF_CONFLICT, IMMUTABLE_FIELD and VALIDATION. The differential engine shared with update_page / update_plan refuses a zero-hit `find` with FIND_NOT_FOUND, a count off `expectedMatches` with MATCH_COUNT_MISMATCH (anchor + line positions) and overlapping matches with INVALID_ARGUMENT; `insert_after_section` without `anchor` or `heading` is MISSING_TARGET. Assumed: the input-shape errors the window names (both shapes, neither, half the action shape, anchor/heading with textEdits) are the row's VALIDATION; the catalog keeps declaring the engine's and the section-insert codes beside the row's four, because the operation raises them. Suggestion: add FIND_NOT_FOUND and MATCH_COUNT_MISMATCH (and INVALID_ARGUMENT / MISSING_TARGET, or say they fold into VALIDATION) to the row's code cell, as the update_plan row does.",
  "assumption": "ASSUMPTION:m21-dev-0001 — update_brief declares the diff engine's codes beside the row's four.",
  "unit": "m21-brief-tools",
  "portion": "m21-brief-tools/p1-l2-l14",
  "sent": true,
  "patchPath": "2-1-13-to-2-1-14-workflow-m21-brief-tools-l3-at-2.md"
}