{
  "id": "dev-2802",
  "kind": "missing",
  "blocking": false,
  "address": "ui-kit-type-package/esn4za5k",
  "text": "Domain & services (L2) leaves open (todo) whether the audit is realised by a backend.service slot or by the server itself. The package realises it in the ui-kit-component-tools server (pure function auditUiKitComponents fed by the bound read operations); the contribution declares only backend.mcpServer. Also: the page leaves the formal codes of the two audit refusals open (todo in 6o1rfh21); the package uses NOT_FOUND (slug without a record, HTTP 404 through the proxy) and VALIDATION (unknown rule, HTTP 400). The host operation catalog got a plugin row audit_ui_kit_components (read, idempotent; cli n/a; rest via the generic proxy) so read-only profiles admit it.",
  "assumption": "ASSUMPTION:dev-2802 — the audit is realised by the server itself; the type declares no backend.service.",
  "unit": "ui-kit-type-package",
  "portion": "ui-kit-type-package/p1-l1-l12",
  "sent": true,
  "patchPath": "2-1-27-to-2-1-28-ui-kit-type-package-esn4za5k-domain-services-l2-leaves-open-todo-whether-the-aud.md"
}